{
  "$schema": "https://json-schema.org/draft/2020-12/schema",
  "$id": "https://kitchendb.net/data/schemas/recipes.json",
  "title": "Recipe",
  "description": "A Recipe",
  "type": "object",
  "properties": {
    "timestamp": {
      "description": "time the recipe was submitted",
      "type": "string"
    },
    "version": {
      "description": "The version number. Always \"1\".",
      "type": "string"
    },
    "name": {
      "description": "Human readable name of the recipe.",
      "type": "string"
    },
    "summary": {
      "description": "short summary that goes before the recipe.",
      "type": "string",
      "maxLength": 480
    },
    "yields": {
      "description": "number of servings recipe makes",
      "type": "integer",
      "minimum": 1
    },
    "yieldsUnit": {
      "description": "The unit of what the recipe yields",
      "type": "string"
    },
    "categories": {
      "description": "list of categories for further recipe refinement",
      "type": "array",
      "items": {
        "type": "string",
        "enum": [
          "side dish",
          "breakfast",
          "lunch",
          "dinner",
          "appetizer",
          "dessert",
          "drink",
          "pasta",
          "cocktail",
          "mocktail",
          "vegetarian",
          "vegan",
          "gluten-free",
          "seasonal",
          "cookout",
          "crock pot",
          "soup",
          "snack",
          "condiment/dressing"
        ]
      }
    },
    "originalSource": {
      "description": "Link to the original source of the recipe",
      "type": "string"
    },
    "ingredients": {
      "description": "List of ingredients, divided into one or more sections",
      "type": "array",
      "minItems": 1,
      "items": {
        "type": "object",
        "properties": {
          "sectionTitle": {
            "description": "Title of the section. If only one section, use \"\"",
            "type": "string"
          },
          "ingredients": {
            "description": "The ingredients for the section",
            "type": "array",
            "minItems": 1,
            "items": {
              "type": "object",
              "properties": {
                "unit": {
                  "description": "unit of measurement",
                  "type": "string",
                  "enum": [
                    "lb",
                    "oz",
                    "g",
                    "cup",
                    "fl oz",
                    "ml",
                    "pint",
                    "tsp",
                    "tbsp",
                    "pinch",
                    "kg",
                    "gal",
                    "liter"
                  ]
                },
                "customUnit": {
                  "description": "use for non-standard unit of measurement",
                  "type": "string"
                },
                "amount": {
                  "description": "the quantity of the measurement",
                  "type": "array", "minItems": 1, "maxLength": 2 
                },
                "ingredient": {
                  "description": "The name of the ingredient",
                  "type": "string"
                },
                "modifier": {
                  "description": "A way to arrange or prep ingredient. i.e. 'chopped'",
                  "type": "string"
                }
              },
              "required": [
                "ingredient"
              ]
            }
          }
        },
        "required": [
          "sectionTitle",
          "ingredients"
        ]
      }
    },
    "steps": {
      "description": "The series of steps for making the recipe",
      "type": "array",
      "minItems": 1,
      "items": {
        "type": "object",
        "description": "A group of steps",
        "properties": {
          "sectionTitle": {
            "description": "Title of the section. If only one section, use \"\"",
            "type": "string"
          },
          "steps": {
            "type": "array",
            "description": "steps in the section",
            "minItems": 1,
            "items": {
              "type": "string",
              "description": "A single step"
            }
          }
        }
      }
    },
    "media": {
      "type": "array",
      "description": "online media related to the recipe, such as videos or photos",
      "items": {
        "type": "object",
        "description": "media item",
        "properties": {
          "type": {
            "type": "string",
            "enum": [
              "photo",
              "video",
              "youtube",
              "vimeo",
              "post",
              "other"
            ]
          },
          "link": {
            "description": "usually a hyperlink to the media source",
            "type": "string"
          },
          "comment": {
            "description": "free-use text for providing additional context to item",
            "type": "string"
          }
        },
        "required": ["type"]
      }
    },
    "attribution": {
      "description": "properties relating to author attribution and credit",
      "type": "object",
      "properties": {
        "name": {
          "description": "Real or username",
          "type": "string"
        },
        "links": {
          "description": "social media and other links relating to the author (not necessarily the recipe)",
          "type": "array",
          "items": {
            "type": "object",
            "properties": {
              "type": {
                "type": "string"
              },
              "link": {
                "type": "string"
              }
            }
          }
        }
      }
    }
  },
  "required": [
    "version",
    "name",
    "ingredients",
    "steps",
    "timestamp"
  ]
}