{
  "version": "1",
  "name": "Apple Crisp",
  "summary": "",
  "steps": [
    {
      "sectionTitle": "",
      "steps": [
        "Preheat oven to 350 degrees F",
        "Place sliced apples in a 9x13-inch baking dish. Mix white sugar, 1 tablespoon flour, and cinnamon; sprinkle over apples. Pour water evenly over apples.",
        "Combine oats, 1 cup flour, brown sugar, baking powder and baking soda in a bowl. Add melted butter and mix with a fork until crumbly. Sprinkle over apples.",
        "Bake in the oven until top is golden brown and apples are bubbling around the edges, around 45 mins."
      ]
    }
  ],
  "categories": ["dessert", "vegetarian"],
  "ingredients": [
    {
      "sectionTitle": "",
      "ingredients": [
        {
          "amount": [10.0],
          "customUnit": "",
          "ingredient": "cups all-purpose apples",
          "modifier": "peeled, cored and slice"
        },
        {
          "amount": [0.5],
          "unit": "cup",
          "ingredient": "white sugar"
        },
        {
          "amount": [1.0],
          "unit": "tbsp",
          "ingredient": "all-purpose flour"
        },
        {
          "amount": [1.0],
          "unit": "tsp",
          "ingredient": "ground cinnamon"
        },
        {
          "amount": [0.5],
          "unit": "cup",
          "ingredient": "water"
        },
        {
          "amount": [1.0],
          "unit": "cup",
          "ingredient": "quick-cooking oats"
        },
        {
          "amount": [1.0],
          "unit": "cup",
          "ingredient": "all-purpose flour"
        },
        {
          "amount": [1.0],
          "unit": "cup",
          "ingredient": "packed brown sugar"
        },
        {
          "amount": [0.25],
          "unit": "tsp",
          "ingredient": "baking powder"
        },
        {
          "amount": [0.25],
          "unit": "tsp",
          "ingredient": "baking soda"
        },
        {
          "amount": [0.5],
          "unit": "cup",
          "ingredient": "butter",
          "modifier": "melted"
        }
      ]
    }
  ],
  "timestamp": "10/25/2022 20:56:25"
}