{
  "version": "1",
  "name": "Beef Lo Mein",
  "summary": "",
  "steps": [
    {
      "sectionTitle": "",
      "steps": [
        "Cook pasta in salted boiling water according to package\u2019s instruction.",
        "Mince garlic, prepare the rest of vegetables.",
        "Add 3 TBS sesame oil in a large pan over medium-high heat. Add garlic. Stir occasionally.",
        "Slice chicken into thin pieces. Add chicken in the pan, cook until slightly white.",
        "Add vegetables, stir occasionally.",
        "Mix all sauce ingredients together. Add into the pan.",
        "Stir occasionally until slightly thicken.",
        "Add cooked pasta. Stir for a minute or until the sauce is almost dry. Remove from heat.",
        "Serve hot, sprinkle with some sesame seed for garnishing."
      ]
    }
  ],
  "ingredients": [
    {
      "sectionTitle": "Pasta dish",
      "ingredients": [
        {
          "amount": [
            3.0
          ],
          "customUnit": "",
          "ingredient": "cloves garlic"
        },
        {
          "amount": [
            1.0
          ],
          "customUnit": "",
          "ingredient": "large carrot",
          "modifier": "3 oz (85g)"
        },
        {
          "amount": [
            10.0
          ],
          "unit": "oz",
          "ingredient": "- 16 oz (283 g - 463g) broccoli"
        },
        {
          "amount": [
            3.0
          ],
          "unit": "oz",
          "ingredient": "snow peas"
        },
        {
          "amount": [
            3.0
          ],
          "unit": "tbsp",
          "ingredient": "sesame oil"
        }
      ]
    },
    {
      "sectionTitle": "sauce",
      "ingredients": [
        {
          "amount": [
            0.25
          ],
          "unit": "cup",
          "ingredient": "soy sauce"
        },
        {
          "amount": [
            0.25
          ],
          "unit": "cup",
          "ingredient": "water"
        },
        {
          "amount": [
            3.0
          ],
          "unit": "tbsp",
          "ingredient": "sesame oil"
        },
        {
          "amount": [
            1.0
          ],
          "unit": "tbsp",
          "ingredient": "sugar"
        },
        {
          "amount": [
            0.5
          ],
          "unit": "tsp",
          "ingredient": "ground pepper"
        },
        {
          "amount": [
            0.25
          ],
          "unit": "tsp",
          "ingredient": "red pepper flakes",
          "modifier": "optional for a kick"
        },
        {
          "amount": [
            1.0
          ],
          "unit": "tsp",
          "ingredient": "ground ginger"
        }
      ]
    }
  ],
  "timestamp": "11/4/2022 23:00:00"
}